<?xml version="1.0" encoding="ISO-8859-1"?>
<xs:schema xmlns:xs='http://www.w3.org/2001/XMLSchema'>

    <xs:element name="cereales">
        <xs:complexType>
            <xs:sequence>
                <xs:element ref="cereal" minOccurs="0" maxOccurs="unbounded" />
            </xs:sequence>
        </xs:complexType>
    </xs:element>

    <xs:element name="cereal" type="xs:string" />

</xs:schema>
